table_name,column_name,data_type,constraints,description,fhir_resource,fhir_field,category,contains_phi,relationships,enum_values,search_text
CONCEPT_DIMENSION,concept_id,VARCHAR,PK NOT NULL,Unique identifier for a concept in the terminology dimension,,,TERMINOLOGY,N,,,"CONCEPT_DIMENSION concept_id PK unique identifier concept terminology dimension"
CONCEPT_DIMENSION,code_system_id,VARCHAR,FK NOT NULL,Foreign key to the code system,,,TERMINOLOGY,N,FK->CODE_SYSTEM.code_system_id,,"CONCEPT_DIMENSION code_system_id FK CODE_SYSTEM"
CONCEPT_DIMENSION,code,VARCHAR,NOT NULL,The terminology code value,,,TERMINOLOGY,N,,,"CONCEPT_DIMENSION code terminology code value SNOMED ICD RxNorm LOINC"
CONCEPT_DIMENSION,display,VARCHAR,NOT NULL,Human-readable display text for the concept,,,TERMINOLOGY,N,,,"CONCEPT_DIMENSION display human-readable concept text"
CONCEPT_DIMENSION,semantic_group,VARCHAR,NULLABLE,Semantic grouping of the concept,,,TERMINOLOGY,N,,"DISEASE|SYMPTOM|PROCEDURE|LAB|MEDICATION|ANATOMY|DEVICE|SOCIAL|FAMILY|TUMOR|SCORE|ROUTE|OTHER","CONCEPT_DIMENSION semantic_group DISEASE SYMPTOM PROCEDURE LAB MEDICATION ANATOMY DEVICE SOCIAL FAMILY TUMOR SCORE ROUTE OTHER route of administration"
